variable,source,frequency,seasonal_adjustment,units,date_range,output_file,notes
real_gdp_per_capita,U.S. Bureau of Economic Analysis via FRED ({ABBR}RGSP + {ABBR}POP for 2001–2004; {ABBR}RQGSP + {ABBR}POP from 2005),quarterly,seasonally adjusted annual rate (real GDP),chained 2017 dollars per person,2001Q1-2025Q4,real_gdp_per_capita_by_state.csv,"Target panel: 2001Q1-2025Q4. Reaches 2001Q1: yes. 2001Q1–2004Q4 values are derived from annual BEA/FRED real GDP by state series {ABBR}RGSP and annual state population {ABBR}POP. Annual values are assigned to all four quarters of the corresponding year. Beginning 2005Q1, values use official quarterly BEA/FRED real GDP by state series {ABBR}RQGSP. Per-capita = real_gdp_millions_chained_2017_dollars × 1,000,000 / population; population = {ABBR}POP × 1000."
personal_income_per_capita,U.S. Bureau of Economic Analysis via FRED ({ABBR}OPCI or {ABBR}OTOT/POP),quarterly,seasonally adjusted annual rate,current dollars per person,2001Q1-2025Q4,personal_income_per_capita_by_state.csv,Target panel: 2001Q1-2025Q4. Reaches 2001Q1: yes. Primary FRED {ABBR}OPCI for AR and IL from 2010 onward; OTOT/POP for 2001–2009 and for all other states across the panel. Annual population merged to quarters; forward-filled within state when missing.
monthly_unemployment_rate,U.S. Bureau of Labor Statistics LAUS via FRED ({ABBR}UR),monthly,seasonally adjusted,percent,2001M1-2025M12,monthly_unemployment_rate_by_state.csv,"Target panel: 2001M1-2025M12. Reaches 2001M1: yes. Statewide unemployment rate via Scrapling/FRED CSV ({ABBR}UR). 2025M10 was blank in the FRED download for all 27 states; values were linearly interpolated from adjacent months (September and November 2025). 2026 observations excluded. margin_of_error: 90% confidence interval half-width from BLS lanrderr.xlsx (latest LAUS release), scaled to each month's rate as rate × (ref_moe / ref_rate); units are percentage points."
quarterly_unemployment_rate,U.S. Bureau of Labor Statistics LAUS via FRED ({ABBR}UR),quarterly,seasonally adjusted (average of monthly SA rates),percent,2001Q1-2025Q4,unemployment_rate_by_state.csv,Target panel: 2001Q1-2025Q4. Reaches 2001Q1: yes. Arithmetic mean of three monthly unemployment rates; complete quarters only. Includes 2025Q4 using interpolated 2025M10 (see monthly notes). margin_of_error: mean of the three monthly margins of error in each quarter (percentage points).
homeownership_rate,U.S. Census Bureau HVS Annual Statistics Table 13 (2001–2004; 2005 bridge) and HVS quarterly Table 3 (2006–2025),quarterly,not seasonally adjusted,percent of occupied housing units owner-occupied,2001Q1-2025Q4,homeownership_rate_by_state.csv,"Target panel: 2001Q1-2025Q4. Reaches 2001Q1: yes. 2001Q1–2004Q4 values are derived from Census HVS Annual Statistics, Table 13: Homeownership Rates by State. Annual values are assigned to all four quarters of the corresponding year. Beginning 2005Q1, values use Census HVS quarterly Table 3: Homeownership Rates by State, 2005-present. Quarterly Table 3 parsed from local file tab3_state05_2026_hmr.xlsx (earliest quarter in file is 2006Q1); 2005Q1–2005Q4 use annual Table 13 assigned to quarters for continuity. 2026Q1 excluded. margin_of_error: Census HVS Table 3 published margin of error for quarterly rows only (percentage points, 90% confidence level); blank for annual-assigned rows."
